{
  "plan_version": "1.1.0",
  "generated_at_utc": "2026-03-08T05:26:28Z",
  "project_slug": "sample_project",
  "mode": "dry_run",
  "plan_status": "ready",
  "install_plan_eligible": true,
  "blocked_reasons": [],
  "sequence_status": {
    "is_contiguous": true,
    "present_sequences": [
      1,
      2
    ],
    "missing_sequences": [],
    "duplicate_sequences": []
  },
  "packages": [
    {
      "sequence": 1,
      "project_slug": "sample_project",
      "package_slug": "core",
      "filename": "zip1_sample_project_core.zip",
      "source_zip_file": "zip1_sample_project_core.zip",
      "relative_path": "sample_project/zip1_sample_project_core.zip",
      "sha256": "90f9a3151281325c273c1757e1038a7b969039f74620e2eeb178ffcb4c0f651e",
      "status": "planned",
      "validation_status": "pass",
      "install_plan_eligible": true,
      "archive_state": "inbox",
      "archive_path": null,
      "size_bytes": 152,
      "findings": [],
      "last_seen_utc": "2026-03-08T05:22:34Z"
    },
    {
      "sequence": 2,
      "project_slug": "sample_project",
      "package_slug": "validation",
      "filename": "zip2_sample_project_validation.zip",
      "source_zip_file": "zip2_sample_project_validation.zip",
      "relative_path": "sample_project/zip2_sample_project_validation.zip",
      "sha256": "cde3ecc4051e9c6e1a75b5a64162ada75f80e1ba1db48de397489b68a3a5dc6a",
      "status": "planned",
      "validation_status": "pass",
      "install_plan_eligible": true,
      "archive_state": "inbox",
      "archive_path": null,
      "size_bytes": 166,
      "findings": [],
      "last_seen_utc": "2026-03-08T05:22:34Z"
    }
  ],
  "actions": [
    {
      "step": 1,
      "action": "discover_inbox"
    },
    {
      "step": 2,
      "action": "validate_naming_order_and_isolation"
    },
    {
      "step": 3,
      "action": "refresh_internal_registry"
    },
    {
      "step": 4,
      "action": "load_project_manifest_or_defaults"
    },
    {
      "step": 5,
      "action": "extract_zip_to_staging"
    },
    {
      "step": 6,
      "action": "route_contract_reference_assets"
    },
    {
      "step": 7,
      "action": "route_runtime_executable_assets"
    },
    {
      "step": 8,
      "action": "apply_wiring"
    },
    {
      "step": 9,
      "action": "run_quality_gates"
    },
    {
      "step": 10,
      "action": "write_install_report_and_ledger"
    },
    {
      "step": 11,
      "action": "archive_processed_or_failed_packages"
    }
  ],
  "quality_gates": [
    "filename_valid",
    "project_folder_isolation_valid",
    "sequence_contiguous",
    "no_duplicate_sequences",
    "routing_destinations_allowed",
    "report_written"
  ],
  "routing_model": {
    "destination_classes": [
      "contract_reference",
      "runtime_executable"
    ]
  }
}
